{
  "workload_name": "payments",
  "environment": "prod",
  "owner": "payments-platform@contoso.com",
  "cost_center": "CC-1042",
  "connectivity_model": "hub_spoke",
  "subscription": {
    "billing_scope": "/providers/Microsoft.Billing/billingAccounts/0000000/enrollmentAccounts/000000",
    "management_group_id": "alz-landingzones-prod",
    "location": "westeurope"
  },
  "governance": {
    "subscription_tags": {
      "business_unit": "finance",
      "data_class": "confidential"
    },
    "policy_assignments": [
      {
        "name": "pa-allowed-locations",
        "policy_definition_id": "/providers/Microsoft.Authorization/policyDefinitions/e56962a6-4747-49cd-b67b-bf8b01975c4c",
        "enforcement_mode": "Default",
        "display_name": "Allowed locations",
        "parameters_json": "{\"listOfAllowedLocations\":{\"value\":[\"westeurope\",\"northeurope\"]}}"
      }
    ]
  },
  "rbac": [
    {
      "principal_id": "11111111-1111-1111-1111-111111111111",
      "definition": "Owner",
      "principal_type": "Group",
      "relative_scope": ""
    },
    {
      "principal_id": "22222222-2222-2222-2222-222222222222",
      "definition": "Reader",
      "principal_type": "Group",
      "relative_scope": ""
    }
  ],
  "budget": {
    "amount": 5000,
    "time_grain": "Monthly",
    "start": "2026-07-01T00:00:00Z",
    "end": "2028-12-31T23:59:59Z",
    "threshold_percent": 80,
    "contact_emails": [
      "payments-platform@contoso.com",
      "finops@contoso.com"
    ]
  },
  "network": {
    "hub_network_resource_id": "/subscriptions/00000000-0000-0000-0000-000000000000/resourceGroups/rg-connectivity/providers/Microsoft.Network/virtualNetworks/vnet-hub-weu",
    "spoke_address_space": [
      "10.140.0.0/24"
    ],
    "spoke_subnet_prefixes": [
      "10.140.0.0/26"
    ]
  }
}